row, 6
id,name,description,itemtype,rarity,price,weight
key,string,string,string,string,int,float
ITM_001,빛의 인도자,성스러운 빛을 내뿜는 전설적인 장검입니다. 언데드 추가 피해를 입힙니다.,Weapon,Legendary,5000,4.5
ITM_002,회복 물약,사용자의 체력을 50만큼 즉시 회복시킵니다.,Consumable,Common,50,0.5
ITM_003,그림자 망토,착용 시 적에게 발각될 확률이 20% 감소합니다.,Armor,Rare,1200,1.2
ITM_004,드래곤 스케일 방패,고대 용의 비늘로 제작되어 화염 저항력이 매우 높습니다.,Armor,Epic,3500,8.0
ITM_005,마력의 반지,착용자의 초당 마나 재생량을 2.5만큼 증가시킵니다.,Accessory,Uncommon,800,0.1
ITM_006,낡은 나침반,길을 잃지 않게 도와주는 유용한 도구입니다.,Quest,Common,0,0.3
